{
  "schema_version": "1.0",
  "kind": "skill",
  "id": "console-status-ui-developer",
  "description": "Terminal status UI",
  "owner_agent_id": null,
  "dependency_ids": [],
  "required_capability_ids": [],
  "knowledge_queries": [
    "Terminal status UI"
  ],
  "origin": {
    "project": "Tiny-Swarm-World",
    "source": ".agents/skills/console-status-ui-developer/SKILL.md",
    "migration_status": "MIGRATED"
  }
}

