{
  "schema_version": "1.0",
  "kind": "skill",
  "id": "python-cli-automation",
  "description": "TSW CLI orchestration",
  "owner_agent_id": null,
  "dependency_ids": [],
  "required_capability_ids": [],
  "knowledge_queries": [
    "TSW CLI orchestration"
  ],
  "origin": {
    "project": "Tiny-Swarm-World",
    "source": ".agents/skills/python-cli-automation/SKILL.md",
    "migration_status": "MIGRATED"
  }
}

