{
  "schema_version": "1.0",
  "kind": "skill",
  "id": "network-topology-design",
  "description": "TSW VM and Swarm topology",
  "owner_agent_id": null,
  "dependency_ids": [],
  "required_capability_ids": [],
  "knowledge_queries": [
    "TSW VM and Swarm topology"
  ],
  "origin": {
    "project": "Tiny-Swarm-World",
    "source": ".agents/skills/network-topology-design/SKILL.md",
    "migration_status": "MIGRATED"
  }
}

