{
  "schema_version": "1.0",
  "kind": "skill",
  "id": "documentation-generation",
  "description": "TSW documentation generation",
  "owner_agent_id": null,
  "dependency_ids": [],
  "required_capability_ids": [],
  "knowledge_queries": [
    "TSW documentation generation"
  ],
  "origin": {
    "project": "Tiny-Swarm-World",
    "source": ".agents/skills/documentation-generation/SKILL.md",
    "migration_status": "MIGRATED"
  }
}

