{
  "schema_version": "1.0",
  "kind": "skill",
  "id": "image-versioning-tagging",
  "description": "Container image version governance",
  "owner_agent_id": null,
  "dependency_ids": [],
  "required_capability_ids": [],
  "knowledge_queries": [
    "Container image version governance"
  ],
  "origin": {
    "project": "Tiny-Swarm-World",
    "source": ".agents/skills/image-versioning-tagging/SKILL.md",
    "migration_status": "MIGRATED"
  }
}

