{
  "schema_version": "1.0",
  "kind": "skill",
  "id": "quality-testing-strategy",
  "description": "Deterministic regression strategy",
  "owner_agent_id": null,
  "dependency_ids": [],
  "required_capability_ids": [],
  "knowledge_queries": ["deterministic regression strategy"],
  "origin": {
    "project": "Tiny-Swarm-World",
    "source": ".agents/skills/quality-testing-strategy/SKILL.md",
    "migration_status": "MIGRATED"
  }
}
