{
  "schema_version": "1.0",
  "kind": "skill",
  "id": "swarm-volume-network-governance",
  "description": "Swarm volume and network safety",
  "owner_agent_id": null,
  "dependency_ids": [],
  "required_capability_ids": [],
  "knowledge_queries": [
    "Swarm volume and network safety"
  ],
  "origin": {
    "project": "Tiny-Swarm-World",
    "source": ".agents/skills/swarm-volume-network-governance/SKILL.md",
    "migration_status": "MIGRATED"
  }
}

