{
  "schema_version": "1.0",
  "kind": "skill",
  "id": "security-threat-modeling",
  "description": "Threat modeling across boundaries",
  "owner_agent_id": null,
  "dependency_ids": [],
  "required_capability_ids": [],
  "knowledge_queries": ["threat modeling across boundaries"],
  "origin": {
    "project": "Tiny-Swarm-World",
    "source": ".agents/skills/security-threat-modeling/SKILL.md",
    "migration_status": "MIGRATED"
  }
}
