{
  "schema_version": "1.0",
  "kind": "skill",
  "id": "service-decomposition-bounded-context",
  "description": "Service ownership and boundaries",
  "owner_agent_id": null,
  "dependency_ids": [],
  "required_capability_ids": [],
  "knowledge_queries": ["service ownership and boundaries"],
  "origin": {
    "project": "Tiny-Swarm-World",
    "source": ".agents/skills/service-decomposition-bounded-context/SKILL.md",
    "migration_status": "MIGRATED"
  }
}
