{
  "schema_version": "1.0",
  "kind": "skill",
  "id": "testing-junit6",
  "description": "Java/JUnit testing if verified",
  "owner_agent_id": null,
  "dependency_ids": [],
  "required_capability_ids": [],
  "knowledge_queries": [
    "Java/JUnit testing if verified"
  ],
  "origin": {
    "project": "Tiny-Swarm-World",
    "source": ".agents/skills/testing-junit6/SKILL.md",
    "migration_status": "MIGRATED"
  }
}

