{
  "schema_version": "1.0",
  "kind": "skill",
  "id": "kubernetes-expert",
  "description": "Future Kubernetes readiness",
  "owner_agent_id": null,
  "dependency_ids": [],
  "required_capability_ids": [],
  "knowledge_queries": [
    "Future Kubernetes readiness"
  ],
  "origin": {
    "project": "Tiny-Swarm-World",
    "source": ".agents/skills/kubernetes-expert/SKILL.md",
    "migration_status": "MIGRATED"
  }
}

